catalog,position,person,personID,start,gender,DOB,DOD,image,enwiki
Chad,President,Mahamat Déby Itno,Q16206405,2021-04-20,male,1984-01-01,,"Participation of Ursula von der Leyen, President of the European Commission, in the 6th European Union Africa Union Summit (cropped).jpg",Mahamat Déby
Chad,Prime Minister,Saleh Kebzabo,Q7403916,2022-10-13,male,1947-03-27,,Saleh Kebzabo.jpg,Saleh Kebzabo
Chad,Minister of Commerce and Industry,Achta Djibrine Sy,Q75004649,2019-08-19,female,1962-10-28,,Achta Djibrine Sy.jpg,Achta Djibrine Sy
Chad,Minister of Tourism Development,Ahmat Barkai Animi,Q107492546,2008-04-23,male,,,,
Chad,Secretary of State for Finance and Budget,Ndolenodji Alixe Naïmbaye,Q108188479,2020-07-14,female,,,Ndolenodji Alixe Naïmbaye - 2018 (cropped).jpg,
Chad,President of the High Authority for Media and Audiovisual,Dieudonné Djonabaye,Q93365576,2018-09-14,male,,,Dieudonné Djonabaye.jpg,
