position,person,personID,start,end,gender,DOB,DOD,image,enwiki
President,Julio María Sanguinetti,Q311428,1995-03-01,2000-03-01,male,1937-01-06,,Juliomariasanguinetti.jpg,Julio María Sanguinetti
President,Jorge Batlle Ibáñez,Q15147,2000-03-01,2005-03-01,male,1927-10-25,2016-10-24,Jorge Batlle.jpg,Jorge Batlle
President,Tabaré Vázquez,Q9099,2005-03-01,2010-03-01,male,1940-01-17,2020-12-06,Tabaré26022007.jpg,Tabaré Vázquez
President,José Mujica,Q9094,2010-03-01,2015-03-01,male,1935-05-20,,Mujica.jpg,José Mujica
President,Tabaré Vázquez,Q9099,2015-03-01,2020-03-01,male,1940-01-17,2020-12-06,Tabaré26022007.jpg,Tabaré Vázquez
President,Luis Lacalle Pou,Q6800406,2020-03-01,,male,1973-08-11,,Foto Oficial Presidente Luis Lacalle Pou (cropped).jpg,Luis Lacalle Pou
Vice President,Hugo Fernández Faingold,Q961599,1998-10-03,2000-03-01,male,1947-03-01,,Batllefaingbis.jpg,Hugo Fernández Faingold
Vice President,Luis Hierro López,Q961132,2000-03-01,2005-03-01,male,1947-01-06,,Luis Hierro López.jpg,Luis Antonio Hierro López
Vice President,Rodolfo Nin Novoa,Q1344343,2005-03-01,2010-03-01,male,1948-01-25,,Rice and Nin Novoa.jpg,Rodolfo Nin Novoa
Vice President,Lucía Topolansky,Q977078,2017-09-13,2020-03-01,female,1944-09-25,,Lucía Topolansky (cropped).png,Lucía Topolansky
Vice President,Beatriz Argimón,Q5724101,2020-03-01,,female,1961-08-14,,Beatriz Argimón PN septiembre 2019.jpg,Beatriz Argimón
Minister of Economy and Finance,Isaac Alfie,Q5920552,2003-08-19,2005-03-01,male,1962-04-27,,Alfieisaac.jpg,Isaac Alfie
Minister of Economy and Finance,Mario Bergara,Q5998504,2005-03-01,2008-09-18,male,1965-05-04,,Mariobergara.jpg,Mario Bergara (politician)
Minister of Economy and Finance,Mario Bergara,Q5998504,2013-12-26,2015-03-01,male,1965-05-04,,Mariobergara.jpg,Mario Bergara (politician)
Minister of Economy and Finance,Azucena Arbeleche,Q17622167,2020-03-01,,female,1970-09-29,,,Azucena Arbeleche
Minister of Education and Culture,Pablo da Silveira,Q42392625,2020-03-01,,male,1962-09-21,,Dasilveira.jpg,Pablo Da Silveira
Minister of the Environment,Adrián Peña,Q76823104,2020-08-27,,male,1976-01-20,,,Adrián Peña
Minister of Foreign Affairs,Ernesto Talvi,Q56099858,2020-03-01,2020-07-06,male,1957-06-10,,Ernestotalvi.jpg,Ernesto Talvi
Minister of Foreign Affairs,Francisco Bustillo,Q6436401,2020-07-06,,male,1960-04-01,,Francisco Bustillo.jpg,Francisco Bustillo
minister of Foreign Relations,Rodolfo Nin Novoa,Q1344343,2015-03-01,2020-03-01,male,1948-01-25,,Rice and Nin Novoa.jpg,Rodolfo Nin Novoa
"Minister of Housing, Territorial Planning and Environment",Irene Moreira,Q72980918,2020-03-01,,female,1964,,,Irene Moreira
"Minister of Industry, Energy and Mining",Omar Paganini,Q96276487,2020-03-01,,male,1962-06-02,,,Omar Paganini
Minister of the Interior,Jorge Larrañaga,Q1703861,2020-03-01,2021-05-22,male,1956-08-08,2021-05-22,Jorge Larrañaga4.jpg,Jorge Larrañaga
Minister of the Interior,Luis Alberto Héber,Q6700272,2021-05-24,,male,1957-12-22,,Luis Alberto Heber Fontana.jpg,Luis Alberto Héber
Minister of Labour and Social Welfare,Pablo Mieres,Q1688988,2020-03-01,,male,1959-07-30,,Pablomieres.jpg,Pablo Mieres
"Minister of Livestock, Agriculture, and Fisheries",Fernando Mattos Costa,Q107365095,2021-06-27,,male,1958-12-09,,,
Minister of National Defence,Javier García Duchini,Q3163146,2020-03-01,,male,1963-11-28,,Acto Colón Garcìa 2014 cropped.jpg,Javier García Duchini
Minister of Public Health,Daniel Salinas,Q87157116,2020-03-01,,male,1962-02-17,,DanielSalinas.jpg,Daniel Salinas
Minister of Social Development,Marina Arismendi,Q3038214,2005-03-28,2010-02-28,female,1949-05-30,,Marina Arismendi.jpg,Marina Arismendi
Minister of Social Development,Marina Arismendi,Q3038214,2015-03-01,2020-02-29,female,1949-05-30,,Marina Arismendi.jpg,Marina Arismendi
Minister of Social Development,Pablo Bartol,Q77041234,2020-03-01,2021-05-03,male,1965-11-20,,,Pablo Bartol
Minister of Social Development,Martín Lema,Q41777347,2021-05-03,,male,1982-09-06,,15.02.20 - Apertura XLIX CRR 0820.jpg,Martín Lema
Minister of Tourism,Tabaré Viera,Q1621502,2021-08-23,,male,1955-04-07,,,Tabaré Viera
Minister of Transport and Public Works,Luis Alberto Héber,Q6700272,2020-03-01,2021-05-24,male,1957-12-22,,Luis Alberto Heber Fontana.jpg,Luis Alberto Héber
Minister of Transport and Public Works,José Luis Falero,Q1709330,2021-05-25,,male,1966-05-19,,José Luis Falero en 2014 (cropped).jpg,José Luis Falero
Secretary of the Presidency,Álvaro Delgado Ceretta,Q26727956,2020-03-01,,male,1969-03-11,,AlvaroDelgado-2000x1500.jpg,Álvaro Delgado Ceretta
Director of the Office of Planning and Budget,Isaac Alfie,Q5920552,2020-03-01,,male,1962-04-27,,Alfieisaac.jpg,Isaac Alfie
Speaker of the Chamber of Deputies,Martín Lema,Q41777347,2020-02-15,2021-03-01,male,1982-09-06,,15.02.20 - Apertura XLIX CRR 0820.jpg,Martín Lema
Speaker of the Chamber of Deputies,Alfredo Fratti,Q106512605,2021-03-01,,male,1956,,,
President of the Central Bank,Mario Bergara,Q5998504,2008-11-11,2013-12-26,male,1965-05-04,,Mariobergara.jpg,Mario Bergara (politician)
President of the Central Bank,Alberto Graña,Q16766302,2014-01-10,2015-04-21,male,1954,,,
President of the Central Bank,Mario Bergara,Q5998504,2015-04-21,2018-10-11,male,1965-05-04,,Mariobergara.jpg,Mario Bergara (politician)
President of the Central Bank,Alberto Graña,Q16766302,2018-10-11,2020-03-04,male,1954,,,
President of the Central Bank,Diego Labat,Q110208264,2020-03-20,,male,,,,
Chief of Defence Staff,Gustavo Fajardo,Q110192810,2021-02-01,,male,,,,
