catalog,position,person,personID,start,gender,DOB,DOD,image,enwiki
Somaliland,President,Ahmed Mohamed Mohamoud,Q380187,2010-07-27,male,1936,,The President of Somaliland Ahmed Mohamed Mohamoud Silanyo.jpg,Ahmed Mohamed Mohamoud
Somaliland,President,Muse Bihi Abdi,Q17155777,2017-12-13,male,1948-01-02,,Muse Bihi official portrait 2017 (cropped).jpg,Muse Bihi Abdi
Somaliland,Vice President,Abdirahman Saylici,Q3675842,2010-07-27,male,1956-10-28,,"Abdirahman Abdallahi Ismail Saylici, Vice President of Somaliland (6409719759).jpg",Abdirahman Saylici
Somaliland,Minister of Foreign Affairs,Essa Kayd,Q108477781,2020-03-03,male,,,Essa Keyd.jpg,Essa Kayd
Somaliland,Minister of Health,Omar Ali Abdillahi,Q86259082,2019-04-14,male,,,,Omar Ali Abdillahi
