catalog,position,person,personID,start,end,gender,DOB,DOD,image,enwiki
Trinidad and Tobago,President,A. N. R. Robinson,Q634551,1997-03-18,2003-03-16,male,1926-12-16,2014-04-09,A. N. R. Robinson.jpg,A. N. R. Robinson
Trinidad and Tobago,President,George Maxwell Richards,Q57532,2003-03-17,2013-03-17,male,1931-12-01,2018-01-08,Professor George Maxwell Richards 1 (cropped 2).jpg,George Maxwell Richards
Trinidad and Tobago,President,Anthony Carmona,Q4772220,2013-03-18,2018-03-19,male,1953-03-07,,Anthony Carmona.jpg,Anthony Carmona
Trinidad and Tobago,President,Paula-Mae Weekes,Q47461098,2018-03-19,,female,1958-12-23,,President Paul Mae-Weekes.jpg,Paula-Mae Weekes
Trinidad and Tobago,Prime Minister,Patrick Manning,Q365206,2001-12-24,2010-05-26,male,1946-08-17,2016-07-02,Patrick Manning 2008.jpg,Patrick Manning
Trinidad and Tobago,Prime Minister,Kamla Persad-Bissessar,Q57712,2010-05-26,2015-09-09,female,1952-04-22,,Kamla Persad-Bissesar 2013.jpg,Kamla Persad-Bissessar
Trinidad and Tobago,Prime Minister,Keith Rowley,Q6384971,2015-09-09,,male,1949-10-24,,KeithRowley.jpg,Keith Rowley
Trinidad and Tobago,"Minister of Agriculture, Land and Fisheries",Clarence Rambharat,Q107861273,2015-09-09,2022-03-16,male,,,,
Trinidad and Tobago,"Minister of Agriculture, Land and Fisheries",Kazim Hosein,Q107861248,2022-03-16,,male,,,,
Trinidad and Tobago,Minister of Digital Transformation,Hassel Bacchus,Q107861251,2021-07-12,,male,,,,
Trinidad and Tobago,Minister of Education,Nyan Gadsby-Dolly,Q107504727,2015-09-09,,female,,,,
Trinidad and Tobago,Minister of Energy and Energy Industries,Stuart Young,Q107504646,2015-09-09,,male,,,,
Trinidad and Tobago,Minister of Finance,Colm Imbert,Q5147678,2015-09-09,,male,1957-07-30,,Colm Imbert.jpg,Colm Imbert
Trinidad and Tobago,Minister of Foreign Affairs,Mervyn Assam,Q108461989,2000,2001,male,,,,
Trinidad and Tobago,Minister of Foreign Affairs,Amery Browne,Q107861200,2015-09-09,,male,,,Amery Browne.jpg,
Trinidad and Tobago,Minister of Health,Terrence Deyalsingh,Q107504625,2015-09-09,,male,,,,
Trinidad and Tobago,Minister of Housing and Urban Development,Pennelope Beckles,Q37294256,2015-09-09,2022-03-16,female,1961-09-12,,,Pennelope Beckles
Trinidad and Tobago,Minister of Housing and Urban Development,Camille Robinson-Regis,Q43901152,2022-03-16,,female,1958-05-12,,,Camille Robinson-Regis
Trinidad and Tobago,Minister of Labour,Stephen Mc Clashie,Q107504654,2015-09-09,,male,,,,
Trinidad and Tobago,Minister of National Security,Fitzgerald Hinds,Q107504795,2015-09-09,,male,,,,
Trinidad and Tobago,Minister of Planning and Development,Camille Robinson-Regis,Q43901152,2015-09-09,2022-03-16,female,1958-05-12,,,Camille Robinson-Regis
Trinidad and Tobago,Minister of Planning and Development,Pennelope Beckles,Q37294256,2022-03-16,,female,1961-09-12,,,Pennelope Beckles
Trinidad and Tobago,Minister of Public Administration,Allyson West,Q107861285,2021-07-12,,female,,,,
Trinidad and Tobago,Minister of Public Administration and Digital Transformation,Allyson West,Q107861285,2015-09-09,2021-07-12,female,,,,
Trinidad and Tobago,Minister of Public Utilities,Marvin Gonzales,Q107504750,2015-09-09,,male,,,,
Trinidad and Tobago,Minister of Rural Development and Local Government,Kazim Hosein,Q107861248,2015-09-09,2022-03-16,male,,,,
Trinidad and Tobago,Minister of Rural Development and Local Government,Faris Al-Rawi,Q22279937,2022-03-16,,male,1971-05-02,,"Faris Al-Rawi, 2017.png",Faris Al-Rawi
Trinidad and Tobago,Minister of Social Development and Family Services,Donna Cox,Q107861268,2015-09-09,,female,,,,
Trinidad and Tobago,Minister of Sport and Community Development,Shamfa Cudjoe,Q107504665,2015-09-09,,female,1982,,,Shamfa Cudjoe
Trinidad and Tobago,"Minister of Tourism, Culture and the Arts",Randall Mitchell,Q107861234,2015-09-09,,male,,,,
Trinidad and Tobago,Minister of Trade and Industry,Paula Gopee-Scoon,Q1673889,2015-09-09,,female,1958-04-18,,Barack Obama & Paula Gopee-Scoon at Piarco International Airport 4-19-09.JPG,Paula Gopee-Scoon
Trinidad and Tobago,Minister of Works and Transport,Rohan Sinanan,Q107861221,2015-09-09,,male,,,,
Trinidad and Tobago,Minister of Youth Development and National Service,Foster Cummings,Q107504794,2021-04-19,,male,,,FosterCummings.jpg,Foster Cummings
Trinidad and Tobago,"Minister in the Ministry of Agriculture, Land and Fisheries",Avinash Singh,Q107861281,2015-09-09,,male,,,,
Trinidad and Tobago,"Minister in the Ministry of Agriculture, Land and Fisheries",Nigel de Freitas,Q111826578,2022-03-16,,male,,,,
Trinidad and Tobago,Minister in the Ministry of Education,Lisa Morris-Julian,Q107504770,2015-09-09,,female,,,,Lisa Morris-Julian
Trinidad and Tobago,Minister in the Ministry of Finance,Brian Manning,Q107504941,2015-09-09,,male,,,,Brian Manning (politician)
Trinidad and Tobago,Minister in the Ministry of Housing and Urban Development,Adrian Leonce,Q107504948,2015-09-09,,male,,,,
Trinidad and Tobago,Minister in the Ministry of Public Administration and Digital Transformation,Hassel Bacchus,Q107861251,2015-09-09,2021-07-12,male,,,,
Trinidad and Tobago,Minister in the Office of the Attorney General and Minister of Legal Affairs,Renuka Sagramsingh-Sooklal,Q107861223,2015-09-09,,female,,,,
Trinidad and Tobago,Minister in the Office of the Prime Minister,Symon de Nobriga,Q107504628,2015-09-09,,male,,,,
Trinidad and Tobago,Minister in the Office of the Prime Minister,Stuart Young,Q107504646,2015-09-09,,male,,,,
Trinidad and Tobago,Minister in the Office of the Prime Minister,Ayanna Webster-Roy,Q107504944,2015-09-09,,female,,,,Ayanna Webster-Roy
Trinidad and Tobago,President of the Senate,Christine Kangaloo,Q97400315,2015-09-23,,female,,,The Hon Christine Kangaloo.jpg,Christine Kangaloo
Trinidad and Tobago,Speaker of the House of Representatives,Bridgid Annisette-George,Q22958412,2015-09-23,,female,1958,,Sen The Hon Mrs. Bridgid Annisette-George.jpg,Bridgid Annisette-George
Trinidad and Tobago,Chief Justice,Ivor Archie,Q45363686,2008,,male,,,IvorArchie.jpg,Ivor Archie
Trinidad and Tobago,Attorney-General,Ramesh Maharaj,Q7289419,1996-02,2001-10,male,,,,Ramesh Maharaj
Trinidad and Tobago,Attorney-General,Glenda Morean-Phillip,Q93398652,2001-12,2003-11,female,,,,
Trinidad and Tobago,Attorney-General,John Jeremie,Q93313439,2003-11,2007-11-08,male,,,,
Trinidad and Tobago,Attorney-General,Bridgid Annisette-George,Q22958412,2007-11-08,2009-05-29,female,1958,,Sen The Hon Mrs. Bridgid Annisette-George.jpg,Bridgid Annisette-George
Trinidad and Tobago,Attorney-General,John Jeremie,Q93313439,2009-05-29,2010-05,male,,,,
Trinidad and Tobago,Attorney-General,Anand Ramlogan,Q4751274,2010-05,2015-02,male,1972-08-26,,,Anand Ramlogan
Trinidad and Tobago,Attorney-General,Garvin Nicholas,Q93312900,2015-02-03,2015-09-07,male,1967-01-24,,,
Trinidad and Tobago,Attorney-General,Faris Al-Rawi,Q22279937,2015-09-09,2022-03-16,male,1971-05-02,,"Faris Al-Rawi, 2017.png",Faris Al-Rawi
Trinidad and Tobago,Attorney-General,Reginald Armour,Q111826462,2022-03-16,,male,,,,
Trinidad and Tobago,Chief of Defence Staff,Darryl Daniel,Q109538432,2019-03-25,,male,,,,
Trinidad and Tobago,Governor of the Central Bank,Alvin Hilaire,Q109538422,2015-12-24,,male,,,,
Trinidad and Tobago,First Lady,Patricia Robinson,Q7145811,1997-03-19,2003-03-17,female,1930-03-31,2009-09-10,,Patricia Robinson
Trinidad and Tobago,First Lady,Jean Ramjohn-Richards,Q16097327,2003-03-17,2013-03-18,female,1936,,,Jean Ramjohn-Richards
Trinidad and Tobago,First Lady,Reema Harrysingh-Carmona,Q16211399,2013-03-18,2018-03-19,female,1970-11-22,,Reema Harrysingh-Carmona (cropped).jpg,Reema Harrysingh-Carmona
Trinidad and Tobago,Director of Public Prosecutions,Roger Gaspard,Q59729895,2009-09-17,,male,,,,
